{
  "case_id": "AXIAL-RUN-001",
  "standard": "СП 16.13330.2017",
  "action": "axial_member_strength_and_stability",
  "axial_force_n": 300000.0,
  "net_area_mm2": 1500.0,
  "gross_area_mm2": 1800.0,
  "design_yield_resistance_n_mm2": 338.0952380952381,
  "design_ultimate_resistance_n_mm2": 485.7142857142857,
  "ultimate_resistance_safety_factor": 1.3,
  "working_condition_factor": 1.0,
  "equation_5_resistance_branch": "yield",
  "geometric_slenderness": 49.36783465569003,
  "elastic_modulus_n_mm2": 206000.0,
  "section_type": "b",
  "angle_table_6_case": "multi_bolt_3",
  "angle_attached_leg_net_strip_area_mm2": 250.0,
  "angle_steel_yield_strength_n_mm2": 355.0,
  "single_angle_clause_7_1_2_applicability_confirmed": true,
  "table_6_geometry_case_confirmed": true,
  "special_ten_percent_reduction_applies": false
}
